journey_event_id,journey_id,journey_run_id,university_id,sample_course_id,attempt_number,run_role,use_for_matrix,collection_mode,observer_or_agent_id,event_sequence,event_timestamp,event_type,source_page_url,target_page_url,source_page_type,target_page_type,interaction_label,interaction_locator,onsite_search_query,filter_name,filter_value,clicked_result_rank,click_count_cumulative,backtrack_count_cumulative,elapsed_seconds_from_start,js_render_mode,js_dependency_observed,run_outcome,screenshot_path,dom_snapshot_path,provenance_tool,notes
JE000073,J015,JR0015,UNI08,C015,1,primary_orientation,1,hybrid,codex_desktop,1,2026-04-22T10:10:00+02:00,run_start,,https://www.unimib.it/,,homepage,,,,,,,0,0,0,manual_observation,low,pending,,,shell_curl_live_obs,start from homepage; primary path: homepage nav Studiare dropdown > Corsi di laurea - iscrizioni > Area Formazione > course card
JE000074,J015,JR0015,UNI08,C015,1,primary_orientation,1,hybrid,codex_desktop,2,2026-04-22T10:10:06+02:00,click,https://www.unimib.it/,https://www.unimib.it/didattica/offerta-formativa/corsi-laurea-iscrizioni,homepage,programmes_hub,Corsi di laurea - iscrizioni,Studiare nav dropdown sub-item,,,,,1,0,6,manual_observation,low,pending,,,shell_curl_live_obs,direct sub-item in Studiare nav dropdown; bypasses /studiare overview page
JE000075,J015,JR0015,UNI08,C015,1,primary_orientation,1,hybrid,codex_desktop,3,2026-04-22T10:10:20+02:00,click,https://www.unimib.it/didattica/offerta-formativa/corsi-laurea-iscrizioni,https://www.unimib.it/didattica/offerta-formativa/corsi-laurea-iscrizioni/area-formazione-laurea-triennale-e-laurea-magistrale-ciclo-unico,programmes_hub,intermediate_navigation,Area Formazione,area section link in offerta formativa,,,,,2,0,20,manual_observation,low,pending,,,shell_curl_live_obs,offerta formativa organized into 7 discipline areas; Formazione area contains Comunicazione interculturale
JE000076,J015,JR0015,UNI08,C015,1,primary_orientation,1,hybrid,codex_desktop,4,2026-04-22T10:10:38+02:00,click,https://www.unimib.it/didattica/offerta-formativa/corsi-laurea-iscrizioni/area-formazione-laurea-triennale-e-laurea-magistrale-ciclo-unico,https://www.unimib.it/triennale/comunicazione-interculturale,intermediate_navigation,course_page,Comunicazione interculturale,course card in area-formazione listing,,,,,3,0,38,manual_observation,low,pending,,,shell_curl_live_obs,course card in area-formazione listing; links directly to official course page
JE000077,J015,JR0015,UNI08,C015,1,primary_orientation,1,hybrid,codex_desktop,5,2026-04-22T10:10:45+02:00,run_end,https://www.unimib.it/triennale/comunicazione-interculturale,https://www.unimib.it/triennale/comunicazione-interculturale,course_page,course_page,,,,,,,3,0,45,manual_observation,low,success,,,shell_curl_live_obs,target reached: Comunicazione interculturale; 3 clicks from homepage; area-based discipline navigation
